created_at,text
Sat Nov 30 01:07:51 +0000 2019,Black Friday spins me right round but bop into your local record store for this Record Store Day Black Friday exclusive vinyl of NeverReallyOver and SmallTalk  
Fri Nov 29 11:46:09 +0000 2019,Putting the T in thanksgiving with a traditional tea ceremony in Kyoto Grateful my family is always up for an adventure   Kyotojapan è—å¦“è¡— ç¥‡åœ’å››æ¡ 
Tue Nov 26 17:07:28 +0000 2019,Tell me about it stud The redhot Ameri is available now  ShoesdayTuesday KatyPursey  
Mon Nov 25 20:50:58 +0000 2019,Ever wonder how EUREKA happens Watch and hear how the title Harleys In Hawaii floated into my head and became a full on vibe of a song months later when I brought the idea into the studio This is HarleysInHawaii Explained Vroom Vroom hinny   
Fri Nov 22 20:26:59 +0000 2019,MumBAI for now India I love you  
Thu Nov 21 18:20:22 +0000 2019,I just called to say An allnew season of  starts February 16 2020 only on  Are you ready The bar has been raisssssed 
Thu Nov 21 17:16:21 +0000 2019,Hi Im Heather  HarleysInHawaii   
Tue Nov 19 19:06:35 +0000 2019,All you need is love and maybe a cute bucket bag to match your big heart sweetkinsFall handbags are here  so you can wear your  on your wrist ShoesdayTuesday KatyPursey   
Tue Nov 19 08:05:04 +0000 2019,together our initials are OK and thats what its gonna be  
Tue Nov 19 08:05:04 +0000 2019,together our initials are OK and thats what its gonna be  
Mon Nov 18 19:13:20 +0000 2019,Choose ur ride  HarleysInHawaii  
Mon Nov 18 02:29:48 +0000 2019,Last night in Mumbai for oneplusmusicfestival   timsek  Mumbai Maharashtra 
Sat Nov 16 20:10:08 +0000 2019,"Do you ship  KaDua or Kalipa
ok but seriously such a FAB night in Mumbai for oneplusmusicfestival with qt  thanks to all that braved the traffic and this heat you are the REAL ones   D Y Patil Stadium "
Thu Nov 14 07:22:12 +0000 2019,Happiest 71st His Royal Highness Prince Charles  It was a pleasure spending a little time with you and many brilliant Indian minds looking for incredible solutions to making India a more wonderful 
Wed Nov 13 05:09:39 +0000 2019,Lets spice it up shall we HarleysInHawaii remixes for your personal playlist pleasure   
Wed Nov 13 00:23:38 +0000 2019,No popsicle toes for you this holiday season  Keep your tootsies wrapped up in The Gifter  ShoesdayTuesday  
Tue Nov 12 13:19:38 +0000 2019,They say every single cell of your body rejuvenates itself about every 7 years and its been 7 years since Ive been to India so lets just say a brand new me is ready to partay at the oneplusmusicfestival on Nov 
Tue Nov 12 13:06:02 +0000 2019,Aussie Aussie Aussie Oi Oi Oi Lets break some records  join me in Melbourne on March 8 2020 for the ICC t20worldcup Womens Final Well Roar in support of these awesome women on International Womens Day  
Tue Nov 12 01:07:54 +0000 2019,vrooming into the week like cLiCk ThE lInK BIsH   
Mon Nov 11 23:50:05 +0000 2019,Veterans have a big place in my heart starting with my dad Happy Veterans Day and thank you for your service today and every day  
Sat Nov 09 03:58:44 +0000 2019,and thats a wrap on  auditions  Sunriver Oregon 
Fri Nov 08 07:43:50 +0000 2019,Hi friends heres a new  hot  take on HarleysInHawaii for you the cover come to life   
Thu Nov 07 19:08:25 +0000 2019,About time I got back to India The countdown to the  OnePlus Music Festival  with my girl  is on Check out the  article and see you at the show   
Wed Nov 06 23:44:35 +0000 2019,Might have to agree 
Wed Nov 06 01:04:08 +0000 2019,All the TASTE and ZERO calories Better gingerSNAP these up before your size runs out   ShoesdayTuesday 
Tue Nov 05 19:05:53 +0000 2019,  
Tue Nov 05 01:19:43 +0000 2019,Loves to rev up an engine   HarleysInHawaii 
Sun Nov 03 06:16:57 +0000 2019,"this is living

Egypt Oct 2109  Cairo Egypt "
Fri Nov 01 18:01:47 +0000 2019,Who can pivot faster than a grocery store flipping  for   Im getting the holiday spirit started early with one of my favorite songs Ive written CozyLittleChristmas now available on ALL platforms   
Fri Nov 01 01:23:44 +0000 2019,Ancient Egyptians believed that when you pass on your heart had to be weighed It had to be lighter than a feather to be qualified for the trip to the afterlife My mother has called me feather since I was a little 
Thu Oct 31 20:01:46 +0000 2019,Happy AloHalloween HarleysInHawaii   
Wed Oct 30 20:56:50 +0000 2019,Aloha  Behind the very beautiful scenes of HarleysInHawaii in one of my favorite places on   Kauai 
Tue Oct 29 21:23:27 +0000 2019,Slither into the sunset with these cutie booties   ShoesdayTuesday   
Mon Oct 28 20:54:59 +0000 2019,Hawaiian chic but make it badass  
Fri Oct 25 17:15:14 +0000 2019,35 and never more alive  
Thu Oct 24 22:23:14 +0000 2019,TBT to some v rare BTS of  and I putting those final finishing grooves into  HarleysInHawaii  
Wed Oct 23 21:28:31 +0000 2019,"ASMR HarleysInHawaii
 "
Tue Oct 22 20:21:08 +0000 2019,Who goes from a motorcycle license test straight to a music video set  HarleysInHawaii  
Tue Oct 22 17:38:43 +0000 2019,"Got you SWERVEin lane to lane  ShoesdayTuesday  
 "
Sun Oct 20 23:29:20 +0000 2019,Me at the beginning of the weekend vs at the end of the weekend HarleysInHawaii 
Sun Oct 20 00:00:57 +0000 2019,Theres pink and purple in the sky Have you seen it  HarleysInHawaii 
Sat Oct 19 21:54:26 +0000 2019,
Sat Oct 19 21:49:54 +0000 2019,
Sat Oct 19 21:47:27 +0000 2019,
Fri Oct 18 22:47:38 +0000 2019,out weekWhy dont we get out of town HarleysInHawaii  
Fri Oct 18 00:51:46 +0000 2019,
Thu Oct 17 23:51:14 +0000 2019,SO to my favorite pizza joint in Kauai  Tahiti Nuis  for letting us take over This is the only place I will allow pineapple on my pizza   
Thu Oct 17 20:33:39 +0000 2019,Celebrating Evel Knievels birthday  HarleysInHawaii  
Thu Oct 17 16:13:30 +0000 2019,Have you heard HarleysInHawaii yet   
Wed Oct 16 23:18:03 +0000 2019,Ill be your baby on a Sundayor a Wednesday too HarleysInHawaii   
Wed Oct 16 22:44:40 +0000 2019,
Wed Oct 16 22:43:48 +0000 2019,
Wed Oct 16 19:11:43 +0000 2019,What do ukuleles Cheetos and hula hoops have in common HarleysInHawaii   
Wed Oct 16 15:14:33 +0000 2019,What do you get when you rent a motorcycle for a weekend with your boyfriend in Hawaii A love song of course Harleys In Hawaii out NOW on all platforms  
Wed Oct 16 00:31:31 +0000 2019,In anticipation of tomorrows release for HarleysInHawaii Ill just leave this here for your hires photoshopping pleasure  
Tue Oct 15 19:05:02 +0000 2019,"Get your riding shoes ready  ShoesdayTuesday today HarleysInHawaii  tomorrow

 "
Tue Oct 15 15:08:39 +0000 2019,Tomorrow we ride  HarleysInHawaii  
Mon Oct 14 15:05:52 +0000 2019,HarleysInHawaii 101619  
Sun Oct 13 03:50:38 +0000 2019,hydration and meditation hinny  The Anthem 
Sun Oct 13 01:38:45 +0000 2019,idk bout u but I used to drink all the miniature creamers in the bowls within the first 2 mins of sitting down at a restaurant when I was a kid
Sat Oct 12 18:56:15 +0000 2019,Last night I was so happy to sing at Silence the Violence in DC for the  to benefit  As an avid meditator for almost 10 years its the main tool Ive learned to help me balance my mind 
Fri Oct 11 04:08:39 +0000 2019,Now theres nothing left to promo but SmallTalkRemixes Link in bio 
Thu Oct 10 23:06:33 +0000 2019,TBT to when I went to the real school of rock during the summer of 2008 on   chapmanbaehler  School of Hard Knocks 
Thu Oct 10 04:29:45 +0000 2019,Welp guess youll just have to tune back into  next year to see if any of us kept our jobs   ammiright season3   Milwaukee Wisconsin 
Wed Oct 09 01:03:51 +0000 2019,Well guess whats going to be in your local record store ONLY on Black Friday November 29 This lil vinyl baby  RSDBF 
Tue Oct 08 16:03:25 +0000 2019,Proud my  TERRAIN is a heel that can help HEAL  Presents FFANY Shoes on Sale lets u shop this amp others to benefit breast cancer research amp educationWatch on 1010 from 69pm ET or shop   iShopforHer Shoes4ACure ShoesdayTuesday 
Mon Oct 07 07:32:14 +0000 2019,I got so much admiration and respect for  new film studio in Atlanta Hes got his own White House replica n all Congrats Watch on  IGS to see the dream realized
Thu Oct 03 21:33:41 +0000 2019,Get urself a pup who does it all  missnuggetperry doesnt just star in the videos she does the promo too  See her in action link in bio smalltalk TBT  Small Talk 
Tue Oct 01 21:51:28 +0000 2019,Out here minin for diamonds   Savannah Georgia 
Tue Oct 01 15:12:32 +0000 2019,They said black tie but they didnt say where  Reinvent the dress code with The Adela and The Uni  ShoesdayTuesday  
Mon Sep 30 14:41:44 +0000 2019,Omg woke up to this adorable thread and need to add one that my niece did a few months ago for my sister It makes my heart burst every time I hear it   
Fri Sep 27 15:37:36 +0000 2019,A   cider vinegar a day keeps a throat tickle away but health and wellness close by  FBF ExpoEast 
Fri Sep 27 01:19:56 +0000 2019,Ironic that our smartphones are making us dumbhumans
Thu Sep 26 16:54:25 +0000 2019,My characters in FINAL FANTASY BRAVE EXVIUS are NeverReallyOver so you can play them 365 but you have to check it out before September 30th  FFBEWW 
Tue Sep 24 20:13:27 +0000 2019,Fall boot but make it PSL  Or maybe youre more of a unicorn latte  We gotchu ShoesdayTuesday  
Fri Sep 20 19:39:42 +0000 2019,My baby angel  is a MOOD MoodSwing EP is out now Angels my favorite  which one is yours  
Fri Sep 20 13:08:15 +0000 2019,CHICAGO Im going to make it a Cozy Little Christmas with you and       and  when I see you at the  JingleBash on December 7 Get your  here  
Wed Sep 18 23:15:13 +0000 2019,I still dress like a child to offset adulting  
Wed Sep 18 21:02:56 +0000 2019,watch me perform Small Talk on theellenshow today for clear skin   The Ellen Show 
Wed Sep 18 17:55:37 +0000 2019,SmallTalk  with my friend  TODAY Check your local listings  
Tue Sep 17 20:44:17 +0000 2019,Make a  connection with  this ShoesdayTuesday  
Tue Sep 17 06:40:59 +0000 2019,The lineup is complete My friend     and  will be joining me at the OnePlus Music Festival in Mumbai on November 16  Get your  RIGHT NOW  
Tue Sep 17 04:39:48 +0000 2019,Love looks so good on you Elena Jopling  
Sat Sep 14 16:23:49 +0000 2019,Dont piss missnuggetperry offStream Small Talk Link in bio   Keep It Cute 
Fri Sep 13 16:23:12 +0000 2019,Was so proud to represent my family friend  for  at naturalproductsexpoeast2019 I have been using Braggsapplecidervinegar since I was in my early teens thanks to my momma to keep my 
Tue Sep 10 23:56:40 +0000 2019,"The category is Disco Fever 
The star is The Adora 
Tune in call in buy in  tonight at 900p ET I will be LIVELOVELAUGHING tonight IRL for 
ShoesdayTuesday  "
Mon Sep 09 22:58:11 +0000 2019,What do you talk about when youve been through everything but have nothing left to say  SmallTalk Explained  
Fri Sep 06 22:36:36 +0000 2019,Click here to have a good weekend   
Fri Sep 06 20:58:28 +0000 2019,tres chic  
Thu Sep 05 05:53:07 +0000 2019,ready and waiting  
Tue Sep 03 22:23:10 +0000 2019,"Making of SmallTalkVideo  Episode 3  1  12  1 

 "
Tue Sep 03 16:40:06 +0000 2019,ShoesdayTuesday News Alert  I will be back  on Tuesday September 10 and YOU can join me and  as part of the LIVE studio audience for new  fall styles Sign up for tickets here  PS Access key is KP2019 
Mon Sep 02 15:25:20 +0000 2019,LDW but make it match  smalltalkvideo link in bio  Small Talk 
Sat Aug 31 21:02:31 +0000 2019,
Fri Aug 30 19:06:45 +0000 2019,Go to  to see me and my golden Nuggets  SmallTalkVideo out now 
Fri Aug 30 16:08:30 +0000 2019,"MUTT BALL IS LIFE WE READY  ARE YOU SmallTalkVideo out now 
"
Fri Aug 30 13:09:46 +0000 2019,
Fri Aug 30 04:16:54 +0000 2019,Countdown to Nuggets big turn at The Mutt Ball SmallTalkVideo coming at 900 AM PT tomorrow   
Thu Aug 29 18:27:15 +0000 2019,Which dog will have the biggest transfurmation Who will be our diamond in the ruff The theme is TRAMP not CAMP See you at the Mutt Ball TOMORROW SmallTalkVideo  
Wed Aug 28 17:41:19 +0000 2019,This isnt the relationship video you think it is   SmallTalkVideo coming Friday August 30 
Wed Aug 28 06:57:00 +0000 2019,I am so happy to be returning to India and excited to headline my firstever performance in Mumbai I am looking forward to seeing and singing with all of my Indian KatyCats at the OnePlus Music Festival  
Tue Aug 27 21:09:08 +0000 2019,Fab enough for The Mutt Ball but sensible enough for a walk in the park    ShoesdayTuesday 
Tue Aug 27 18:19:10 +0000 2019,"You want ridiculous videos Well they have to start with ridiculous conversations  Listen inSmallTalkVideo
 "
Mon Aug 26 21:22:34 +0000 2019,Sneak peek to the making of the SmallTalkVideo unleashing this Friday August 30  
Mon Aug 26 18:11:35 +0000 2019,Just some SmallTalk on InternationalDogDay with  on IG See you at The Mutt Ball where we make fetch happen on Friday August 30   
Mon Aug 26 05:29:12 +0000 2019,"So put your rose colored glasses on and party on 

The Dystopian Age by  "
Thu Aug 22 21:56:06 +0000 2019,POTTY JAMS Small Talk  SmallTalk in a mediumsized bathroom  
Thu Aug 22 19:38:49 +0000 2019,So proud that I get to stand next to a hero on screen and in real life orlandobloom  Excited for you all to dive into the new EPIC fantasy world that is carnivalrow coming AUGUST 30TH on   Manns 
Thu Aug 22 02:10:32 +0000 2019,if you actually wear your fanny pack around your waist you will have 7 years of bad luck
Wed Aug 21 21:24:20 +0000 2019,Yes  refuses to let the sunshine fade ever  Thanks  NeverEndingSummer  
Wed Aug 21 18:05:36 +0000 2019,Technically summer doesnt end until September 23rd but it seems like itll be a long one this yearmaybe even a neverending one thanks to this song by   NeverEndingSummer  
Wed Aug 21 06:11:31 +0000 2019,Im having the PRIME of my life lilnasx jeffbezos Nugget  amazon  Old Town Road 
Wed Aug 21 00:24:19 +0000 2019,Add a little shine to your regularly scheduled work lewk with The Jamie this TuesdayShoesday  
Mon Aug 19 20:01:16 +0000 2019,On October 11th Ill be in DC for a special  acoustic  set for the SilencetheViolence Benefit Concert   and  will be joining me to help raise funds for the David Lynch Foundation to 
Sat Aug 17 21:22:04 +0000 2019,Show me your FLOWER POWER with my new SmallTalk filter on instagram click on my profile to find it see 3rd scroll   Small Talk 
Fri Aug 16 17:09:53 +0000 2019,Havent heard SmallTalk yet Now you can head to  to see my new vertical video as you so patiently wait for THE music video   
Thu Aug 15 21:04:15 +0000 2019,honey every day is  day for me when youre the boss mom  updates calendar 
Thu Aug 15 20:12:04 +0000 2019,added to my calendar   
Wed Aug 14 20:23:36 +0000 2019,Is that smalltalk I hear  
Wed Aug 14 20:16:31 +0000 2019, 
Wed Aug 14 20:15:40 +0000 2019,Always lovers MortaLinda 
Wed Aug 14 20:15:06 +0000 2019,
Tue Aug 13 20:04:25 +0000 2019,God spelled backwards is Dog and I dont think that is a coincidence  Puppy Love 
Tue Aug 13 18:16:16 +0000 2019,Whether its SmallTalkor big conversationsthat are NeverReallyOver  has you covered on ShoesdayTuesday and every day  
Sun Aug 11 07:42:55 +0000 2019,Cant we all just be kind and good Why is that so hard
Fri Aug 09 22:15:14 +0000 2019,
Fri Aug 09 21:25:20 +0000 2019,
Fri Aug 09 20:56:09 +0000 2019,bts of my beatboxing brother  on March 11th 2019 doing his savant thing on SmallTalk   Small Talk 
Fri Aug 09 19:31:41 +0000 2019,
Fri Aug 09 19:30:11 +0000 2019, 
Fri Aug 09 18:46:58 +0000 2019,
Fri Aug 09 18:44:32 +0000 2019,Katy Perrys new single Small Talk has arrived   
Fri Aug 09 04:07:37 +0000 2019,Listen to SmallTalk and watch the lyric video  And then join me on IG Live for some small talk of our own  
Fri Aug 09 04:05:43 +0000 2019,meet me on IG imma go live and smalltalk rn 
Fri Aug 09 01:02:27 +0000 2019,Aint it funny Cause now theres nothing left but 
Thu Aug 08 22:02:19 +0000 2019,Strangers  Lovers  Strangers SmallTalk tonight 
Thu Aug 08 19:20:53 +0000 2019,Ready for some SmallTalk tonight Heres a sneak peek  at the song and lyric video  
Thu Aug 08 00:32:08 +0000 2019,100 million digital singles and still insecure   Capitol Records 
Wed Aug 07 18:02:16 +0000 2019,and now theres nothing left but smalltalk  
Wed Aug 07 16:01:08 +0000 2019,SmallTalk 
Wed Aug 07 02:01:45 +0000 2019,SmallTalk 
Wed Aug 07 01:01:42 +0000 2019,SmallTalk 
Tue Aug 06 21:01:49 +0000 2019,SmallTalk 
Tue Aug 06 19:00:48 +0000 2019,If you want to walk a mile in these Hudson shoes  you better have faux crocodile skin Rock out  with your croc out  on this ShoesdayTuesday  
Mon Aug 05 16:05:32 +0000 2019,ITS OFFICIAL 3RD SEASONS A CHARM Excited to get the band back together with  and   Get out there and audition yall 3rd season could be your charmAmericanIdol TheNextIdol 
Sun Jul 28 15:57:54 +0000 2019, happiness entrepreneurs   Spain 
Wed Jul 24 14:39:39 +0000 2019,Certainly fell down a rabbit hole watching your beautifully original versions of NeverReallyOver on   Keep making them and I will for sure keep clicking   
Tue Jul 23 23:33:17 +0000 2019," Heatwave  Tie it back with these Scrunchieinspired slides  ShoesdayTuesday

 "
Fri Jul 19 05:37:09 +0000 2019,He may be a liar but those hips dont lie bb  
Fri Jul 19 04:03:29 +0000 2019,Went to the drug store for ONE box of tissues Got this long ass receipt that is NeverReallyOver  
Thu Jul 18 22:06:36 +0000 2019,For your summer vacay needs consider using  to send some of the money youre already spending to your favorite charities You take the vacation they make the donation
Thu Jul 18 22:06:19 +0000 2019,Proud of my father Keith for continuing to do the good work and being part of the launch of   
Tue Jul 16 20:02:15 +0000 2019,full moon  full mewd
Tue Jul 16 15:53:55 +0000 2019,A new wave of the Beauty School collection is out at  Keep checking back for more new styles  ShoesdayTuesday 
Tue Jul 09 20:31:41 +0000 2019,Shine bright like a diamond  ShoesdayTuesday    
Thu Jul 04 07:13:56 +0000 2019,bb ur a firewerk
Wed Jul 03 01:16:58 +0000 2019,Love  so much youve always wanted to wear it from head to toe Now you can  First round of new  LEWKS are here shoesdaytuesday 
Tue Jul 02 23:04:13 +0000 2019,Mewd 
Sat Jun 29 21:26:45 +0000 2019,if you wanna weekend chuckle watch this Love all youre doing for the environment   
Sat Jun 29 05:34:09 +0000 2019,BIG shout out to  for helping me with my hoarding problems err I mean my collecting problems  thisismylovelanguage  Neat Freak 
Fri Jun 28 19:40:21 +0000 2019,ICYMI the NeverReallyOver vertical video different than the actual music video is now available for your viewing pleasure at  
Fri Jun 28 03:21:32 +0000 2019,not gonna lie i sound like Marianne Williamson after a few glasses of red
Fri Jun 28 02:30:28 +0000 2019,Some of these candidates are more moods than possible presidents lol demdebates2
Fri Jun 28 02:16:07 +0000 2019,emotional moment DemDebate2020 
Fri Jun 28 01:26:46 +0000 2019, 
Fri Jun 28 01:20:17 +0000 2019,three snaps in a z formation lets go 
Wed Jun 26 21:43:40 +0000 2019,this is dreams coming true in real time if it can happen for me it can happen for you sweet    
Wed Jun 26 17:49:44 +0000 2019,Cheers to   Patricia Bragg gave me my first guitar at the age of 13 in Santa Barbara and now orlandobloom and I are so proud to be part of her next chapter Just like the gift of music the gift of 
Tue Jun 25 23:25:19 +0000 2019,sale for all these  lewks because you might just find some new faves starting tomorrow loves  ShoesdayTuesday  
Mon Jun 24 21:07:15 +0000 2019,Check ur email  Were you one of the lucky SpotifyFansFirst few to get a chance at this exclusive NeverReallyOver necklace   If not you can still get your hands on all of the official merch here  
Sun Jun 23 22:03:55 +0000 2019,"Im back in FINAL FANTASY BRAVE EXVIUS and this time my baby Nugget is with me 
Â ffbeww "
Fri Jun 21 18:10:37 +0000 2019,New season who dis Its the first day of summer and its time to MOVE ON with the most  the most  and the most  movingon songs picked by moi AlexaPlay Handpicked with Katy Perry on  NeverReallyOver  
Fri Jun 21 05:00:42 +0000 2019,"KORAgrats on an illuminating vitamin c packed to perfection product  The Nonibright serum   
also love u sissy   Malibu California "
Thu Jun 20 03:09:00 +0000 2019,attracted to high EQ
Wed Jun 19 21:14:14 +0000 2019,"i wish I could dance as well as   neverreallyover 

Repost 

NEVERREALLYOVER  enjoy my take on this cute music video and TAG  IN THE COMMENTS PLS HAPPY PRIDE LOVE U  "
Wed Jun 19 01:54:08 +0000 2019,may the 18th be with u did I do it right  starwarsgalaxysedge disneyland  Star Wars Galaxys Edge 
Tue Jun 18 22:15:24 +0000 2019,Get ready for the first day of summer with your 5 servings of fruit a day      But of course theres always room for dessert  ShoesdayTuesday  
Tue Jun 18 22:10:10 +0000 2019,  maaaaates pls hv ur ppl call my ppl or my ppl will call ur ppl lets make a chune 
Tue Jun 18 19:16:36 +0000 2019,That one mindF  Watch on   NeverReallyOver 
Mon Jun 17 19:08:07 +0000 2019,As my favorite  might say I feel like Ive joined a cult and its all your fault NeverReallyOver BTS here   
Mon Jun 17 12:41:41 +0000 2019,"This meal is BEEFfree MeatFreeMonday  YNTCDmusicvideo

 "
Mon Jun 17 07:08:29 +0000 2019,love u every day dad  Dad Jokes Club 
Fri Jun 14 18:49:46 +0000 2019,The LEWKS are NeverReallyOver  Vertical video now on TodaysTopHits    Also so    
Thu Jun 13 17:01:58 +0000 2019,TBT to when you wrote postcards to the personpetthing thats NeverReallyOver   Tell your story at   
Thu Jun 13 01:09:51 +0000 2019,look at how fing hot my fiancÃ© is orlandobloom lucky me   Too Darn Hot 
Wed Jun 12 22:25:05 +0000 2019,Catch your tear drops  and heal your heart in the cherry blossom fields  with   
Wed Jun 12 19:29:41 +0000 2019,"hi bbs do you wish NeverReallyOver had ended differently Well theres another option on the NeverReallyOver canvas on  
chooseyourownadventure  "
Tue Jun 11 23:52:48 +0000 2019,feels good  taylorswift  Lets Be Friends 
Tue Jun 11 23:30:37 +0000 2019,
Tue Jun 11 18:28:37 +0000 2019,On ShoesdayTuesday and every day take each step with PRIDE    
Tue Jun 11 05:56:23 +0000 2019,the dark side of neverreallyover  
Tue Jun 11 04:29:12 +0000 2019,who told you that 
Tue Jun 11 00:28:15 +0000 2019,"Sometimes I moonlight as  stylist assistant nbd  See my werk here 
 holyrollervideo "
Mon Jun 10 04:02:11 +0000 2019,i am a fearless inspired reflective experiencing exuding wellness openness role model of kindness human being  
Sat Jun 08 06:26:03 +0000 2019,gratitude is one of thee highest vibrations 
Sat Jun 08 06:24:44 +0000 2019,We see you and we love you  
Fri Jun 07 18:54:01 +0000 2019,FBF to the time I got matching tattoos with the greatest people ever The KatyCats  to premiere my NeverReallyOver video   
Thu Jun 06 16:22:53 +0000 2019,TBT to that time I watered my heart garden with my heartbroken tears Have you seen it   
Wed Jun 05 18:36:37 +0000 2019,BOWLED over by your growth as an artist   HolyRollerVideo out now 
Tue Jun 04 21:24:27 +0000 2019,I cant even go on the internet without checking  Links and more in Stories  
Tue Jun 04 06:41:29 +0000 2019,come thru king  
Tue Jun 04 06:40:11 +0000 2019,pls give them a hug from meee 
Tue Jun 04 02:16:58 +0000 2019,"Lose your self control and fall down the rabbit hole of
NeverReallyOver official merch now Link in Stories  "
Sat Jun 01 18:43:45 +0000 2019, Happy Pride Month my angels Let us never stop lifting each other up I see you and I love you  
Sat Jun 01 00:20:44 +0000 2019,bus stop to freedom neverreallyover 
Sat Jun 01 00:01:00 +0000 2019, NeverReallyOver  
Fri May 31 20:52:16 +0000 2019,Guess what happens when you AskAlexa to play the Song of the Day today Thanks   NeverReallyOver SOTD 
Fri May 31 17:30:22 +0000 2019,"Find your first stop to a whole heart 

but dont actually get into any strange white vans ok  "
Fri May 31 17:30:22 +0000 2019,"Find your first stop to a whole heart 

but dont actually get into any strange white vans ok  "
Fri May 31 06:27:26 +0000 2019,thanks for the love yall and congrats to all the wonderful new music out by so many talented goddesses       
Fri May 31 06:12:49 +0000 2019,what a gentle qt king   NeverReallyOver 
Fri May 31 05:46:59 +0000 2019,salt water heals all  NeverReallyOver 
Fri May 31 05:45:45 +0000 2019,yer welcome  
Fri May 31 05:44:40 +0000 2019,sad depot 
Fri May 31 05:40:29 +0000 2019,The goddess that is PhilippaPrice   NeverReallyOver 
Fri May 31 05:37:28 +0000 2019,big breaths comin in hot  
Fri May 31 05:35:51 +0000 2019,tryin harder every day to accept myself  NeverReallyOver 
Fri May 31 05:28:26 +0000 2019,why not be cute n get healed at the same time too   on IG  
Fri May 31 04:59:50 +0000 2019,when u just cant neverreallyover 
Fri May 31 04:51:07 +0000 2019,Not today or any day satan  love you glad youre ok 
Fri May 31 04:21:42 +0000 2019,Wanna  NeverReallyOver on   
Fri May 31 04:06:12 +0000 2019,Ready to raise your vibrations   NeverReallyOver out now  
Fri May 31 00:16:08 +0000 2019,My love for KatyCats is NeverReallyOver  Last night was a super groovy hang youtubemusic Watch page link in bio 
Thu May 30 18:00:01 +0000 2019,Moms Home  NeverReallyOver 
Thu May 30 16:45:45 +0000 2019,it was the best and you werent even a mess Love you and love spending that quality time with you  our connection is NeverReallyOver 
Thu May 30 05:01:29 +0000 2019,She will be unveiled NeverReallyOver watch page live now  
Wed May 29 19:34:10 +0000 2019, 
Wed May 29 17:06:23 +0000 2019,Let it go NeverReallyOver 53119  
Tue May 28 15:06:12 +0000 2019,53119  NeverReallyOver  
Mon May 27 19:28:52 +0000 2019,My dad served in the army and returned from his service but I am aware not many are as lucky Taking today to bring awareness to one of my favorite orgs that helps those veterans that are still with us  thankyouforyourservice
Sat May 25 07:25:20 +0000 2019,You pay me with good chunes kid 
