created_at,text
Thu Mar 08 18:25:24 +0000 2018,"

Now its time for the rest of the  See you tonight Santiago "
Thu Mar 08 17:22:49 +0000 2018,more days til you can see how much  amp  just get me   premieres on  this SUNDAY  
Thu Mar 08 02:40:00 +0000 2018,TFW you know youve found a  in the rough  days until the  premiere on  
Wed Mar 07 09:12:13 +0000 2018,BARCELONA Your turn to roll  with me and  is coming soon  to WitnessTheTour at Palau Sant Jordi on June 28 are available now  
Wed Mar 07 03:36:32 +0000 2018,"Heart Talk by my sistergoddess Cleo Wade is available now
Fill your  like shes filled mine "
Tue Mar 06 23:41:18 +0000 2018,FIVE DAYS TIL THE AmericanIdol premiere I cant wait for you to hear all the   all of the and feel all the  RETWEET this and  will LITERALLY remind you to watch this Sunday on  
Tue Mar 06 14:11:17 +0000 2018,My ladies  and  are going to be witnesses in Europe and UK Check  to see whos coming to see you with me and get your  
Tue Mar 06 04:21:12 +0000 2018,The secret language of   a  cannon and ME on  tonight 1135p1035p Central on  
Mon Mar 05 04:03:08 +0000 2018,Honestly the Oscars should run for President 2020 Bravo for the incredible heart and inclusivity 
Mon Mar 05 03:29:16 +0000 2018,RudolphHaddish2020
Mon Mar 05 02:50:14 +0000 2018,Can the Oscars get a nomination for best set design or is that like sending a thank you card for a thank you card Oscars
Fri Mar 02 20:43:00 +0000 2018,For all my girls who cant hold their tongues still ALRIGHT by  is out everywhere now ensuring your weekend will be   
Fri Mar 02 00:04:31 +0000 2018,My baby bird  turned out ALRIGHT indeed Listen to her wingspan HERE  
Thu Mar 01 05:23:50 +0000 2018,20 
Tue Feb 27 09:03:56 +0000 2018,Trust and believe Im coming for you too Barcelona See you June 28  on sale March 7 
Mon Feb 26 21:16:28 +0000 2018,"Portugal Im coming Ill be at RockinRioLisboa on June 30 w   and more You can get your  now  RockinRio2018 EuVou
Should I pop over to Spain while Im over there  "
Tue Feb 20 03:02:19 +0000 2018,SEOUL Your tickets to Witness The Tour are on sale now Cant wait to  U all and Seoul for the first time  
Sat Feb 17 07:18:58 +0000 2018,thinks about being vegan whilst eating a slim jim
Thu Feb 15 04:43:49 +0000 2018,you dont fall in love you grow in love
Thu Feb 15 04:39:57 +0000 2018,when you crave companionship but run from love when you get it 
Tue Feb 13 05:35:21 +0000 2018,Thats a wrap on the 1st leg of WITNESS THE TOUR Theres no I in TEAM but there is an  in WITNESS amp I have to thank my incredible crew for making it all happen  thank YOU  for coming out amp making this 1st leg awesome See everything on  amp U all soon 
Mon Feb 12 02:56:04 +0000 2018,One month until dreams come true on  AmericanIdol Start planning your premiere party for Sunday March 11th  
Wed Feb 07 00:01:39 +0000 2018,Hey Seoul sisters and brothers  So excited to announce that Im coming to the Gocheok Dome on April 6 Tickets on sale February 20 at 12pm local  
Mon Feb 05 02:19:48 +0000 2018, blametamrashetoldmethewrongthingonwiki
Mon Feb 05 02:05:30 +0000 2018,Drunk Mic stand bruv Quick meme it 
Sun Feb 04 23:37:54 +0000 2018,4 years ago I was given the opportunity to make over 120 million people smile  I will never 
Sat Feb 03 10:02:26 +0000 2018,There can never be too much justice
Sat Feb 03 02:15:41 +0000 2018, MONDAY amp TUESDAY  
Fri Feb 02 05:26:52 +0000 2018,13 days till you have to confess how much you love a person that you just met in JanuaryGet 
Thu Feb 01 03:36:24 +0000 2018,ON DA ROAD AGAIN WITNESSTHETOUR Sacramento  Golden 1 Center 
Wed Jan 31 10:09:06 +0000 2018,SET YOUR INTENTIONS SAY YOUR AFFIRMATIONS AND MANIFEST YOUR DESTINY SuperBlueBloodMoon
Wed Jan 31 01:59:53 +0000 2018,City of fallen angels
Tue Jan 30 08:17:21 +0000 2018,"Another powerful woman leading by example We ALL have a responsibility to call out the absurd lack of equality everywhere we see it Im proud of ALL the women making incredible art in the face of continual resistance 
Ps VH1 Divas Live "
Mon Jan 29 07:39:27 +0000 2018,tbh  2020
Fri Jan 26 21:28:53 +0000 2018,Here is   song and video  about redemption and resurrection out now on  This is my personal MEWD for 2018 FEAST YOUR EYES ON THIS 
Fri Jan 26 07:00:55 +0000 2018,NEW YEAR NEW POWERFUL SONG by  Check it out NOW  VIDEO OUT 2MORROW  
Thu Jan 25 08:49:51 +0000 2018,CrYpTo ClAwS 
Wed Jan 24 07:48:11 +0000 2018,SOUTH AFRICA WITNESSTHETOUR is coming to YOU for  NIGHTS I am over the moon to be performing there for the FIRST TIME EVER Cant wait to  u all  on JULY 18 amp JULY 20  on sale this FRIDAY  9am  
Wed Jan 24 00:41:01 +0000 2018,SCCCCCCCCCUUUUUURRRRRTTTTTTTED into 2018 like   See all the Abu Dhabi New Years Eve adventures on Xfinity 
Tue Jan 23 08:41:10 +0000 2018,Dont ask who wore it best cause it will forever be my dear friend Minerva MouseSo delighted 
Sun Jan 21 00:30:20 +0000 2018,SHOUTOUT TO ALL MY GODDESSES THAT ARE CONTINUING THE RESISTANCE STANDING UP FOR EQUALITY AND 
Sat Jan 20 20:43:41 +0000 2018,This is profoundly powerful So proud of you friend 
Thu Jan 18 21:43:04 +0000 2018,tbt to when I thought I was winning 2018 and then fell into a jellyfish kewl 
Thu Jan 18 04:53:28 +0000 2018,Red hot in ninthlife katykatgloss by me x  for my hot date with  
Thu Jan 18 01:05:12 +0000 2018,PILLOW POUT COMIN THROUGH  
Wed Jan 17 17:30:40 +0000 2018,"On Wednesdays we wearpink or lavender or red KatyKatGloss 
 "
Tue Jan 16 23:39:30 +0000 2018,I just about threw my phone across the room in pride for the words of truth that my friend  just delivered Thank you Cory  
Tue Jan 16 22:50:18 +0000 2018,KatyKatGloss 
Tue Jan 16 20:23:54 +0000 2018,Are you a Candy Cat or do you prefer Cateloupe Are you a Cobalt Kitty or an Indigo Kat  Do you Pounce  or are you a Tabby Tease Show me your KatyKatGloss LEWKS   
Tue Jan 16 14:15:40 +0000 2018,KITTENS KatyKatGloss my NEW line w  is HERE This isnt that 90s gloss that ur hair would get stuck in Its rich amp moisturizing for GLAM  or  all packaged up in a kitty cap Collect all 12 shades  now amp LMK your favs  
Sun Jan 14 07:38:22 +0000 2018,Putting the con in confidence since 1984   Dallas Texas 
Sun Jan 14 01:20:29 +0000 2018,The holidays are over but the season of GIVING is all year longSee some of the wonderful people Ive gotten to meet through   amp  on tour and  more on Xfinity 
Sat Jan 13 07:12:01 +0000 2018,I WANNA SEE U BANGKOK KOK KOK U BANGKOK   Your Witness The Tour tickets are on sale now  
Fri Jan 12 00:10:26 +0000 2018,After 90 years of serving LKS amp smiles as the polka dot queen its time she got that recognition  It will be a childhood and grown adult dream come true for me that day  
Mon Jan 08 05:52:49 +0000 2018,Very encouraged by so many magnificent women unifying and standing together in solidarity saying enough is enough tonight I stand by those women and all my sisters around the world United we cannot be divided TIMESUP
Mon Jan 08 00:16:59 +0000 2018,I dont want to be current I want to be transcendent
Thu Jan 04 18:14:07 +0000 2018,YOU  THINK  THAT  I  AM  CRACKING BUT  YOU  CANT  BREAK  ME   behind the scenes of my video for Hey Hey Hey  
Fri Dec 29 22:09:22 +0000 2017,fbf of Grandma Ann and I casually sitting under thethis year      
Sat Dec 23 17:32:40 +0000 2017,
Thu Dec 21 21:23:10 +0000 2017,tbt to when I put the ho in holidays  North Pole Alaska 
Thu Dec 21 20:03:02 +0000 2017,One of the most beautiful parts of my job is being able to meet people like Rayna  I hope you are as moved as I am by her story and that you will consider  for your holiday giving 
Wed Dec 20 20:04:28 +0000 2017,Hiya Im writing you from Miami prepping my last Witness The Tour show of 2017 Im 
Wed Dec 20 05:58:36 +0000 2017,she quick 
Wed Dec 20 03:14:50 +0000 2017,katyclaus is coming down ur chimney tomorrow with a visual gift ok  Place de la RÃ©volution 
Tue Dec 19 23:02:58 +0000 2017,TOMORROW 
Tue Dec 19 22:05:18 +0000 2017,HEY 
Tue Dec 19 21:07:02 +0000 2017,HEY 
Tue Dec 19 20:02:02 +0000 2017,HEY 
Tue Dec 19 18:50:36 +0000 2017,GUYS heres an easy and fun way to give this holiday season if youre visiting MickeyFor every ears photo shared with ShareYourEars  will donate 5 to one of my fav charities  up to 1 million dollars  
Tue Dec 19 06:52:33 +0000 2017,Mortys 1 stan  Walt Disney World 
Mon Dec 18 19:56:51 +0000 2017,Who would have thought there would be a better scent than gingerbread and pinecones Check out my newest scent INDI available   WhatMakesYouINDI  
Mon Dec 18 15:05:05 +0000 2017,BUENOS AIRES  Welcome  to WITNESSTHETOUR Tickets are at  
Mon Dec 18 15:05:05 +0000 2017,BUENOS AIRES  Welcome  to WITNESSTHETOUR Tickets are at  
Mon Dec 18 12:03:49 +0000 2017,MORTA LINDAAAA  Brazil get your tickets to see  and me on WITNESSTHETOUR   
Sun Dec 17 07:54:24 +0000 2017,A big thank you to all the firefighters amp first responders from all the surrounding areas that have come out to fight these thomasfire flames 805strong
Sun Dec 17 03:13:02 +0000 2017,ready for mars  
Sat Dec 16 19:20:05 +0000 2017,Woke up to wish my mom a happy 70th birthday today to find my brother evacuating them from the insane ThomasFire in Santa Barbara County that has kicked up once again praying for the firefighters amp first responders that are fighting it back as best they can Love you SB
Sat Dec 16 01:03:45 +0000 2017,TOKYO  I cant WAIT to see you again  nights at Saitama Super Arena Your tickets are at  
Sat Dec 16 00:34:06 +0000 2017,Meet your WITNESSTHETOUR concierges Thomas and Michael  They surprise  the biggest KatyCats so I can  you out on the road along with my  x  volunteers  and  angels  See what they do and more at xfinity 
Thu Dec 14 01:52:49 +0000 2017, music lovers existed before socials
Thu Dec 14 01:50:45 +0000 2017, it was a draft and my finger slipped
Thu Dec 14 01:43:09 +0000 2017,i cant wait till instagram culture is over so we can all be ourselves again
Wed Dec 13 17:02:51 +0000 2017,To bring U more  the March 15 Curitiba show is moving to  Porto Alegre at Arena Do Gremio on March 14  for all 3  shows SÃ£o Paulo Rio de Janeiro and Porto Alegre WITH SPECIAL GUEST   go on sale Monday Dec 18 at  
Wed Dec 13 07:35:25 +0000 2017,a democrat in the senate 
Tue Dec 12 06:02:10 +0000 2017,HONG KONG amp JAKARTAI know youve been waiting Will you  WITNESSTHETOUR with me in the Spring All the  info is at  
Mon Dec 11 07:49:07 +0000 2017,Saying a prayer for my hometown of Santa Barbara amp Montecito tonight  The thomasfire is still only 10 contained after devastating Ventura Ojai amp now Carpinteria Over 230000 acres burned Have many friends amp now even my parents evacuate My heart breaks for the 805
Mon Dec 11 05:14:10 +0000 2017,IU SINGAPORE AND MANILAYour  to WITNESSTHETOUR are now on sale  
Sat Dec 09 06:12:45 +0000 2017,TAIPEIYour  to WITNESSTHETOUR are available now Will I  you there  
Thu Dec 07 05:57:15 +0000 2017,Really appreciate you guys and the risk you take keeping us all safe  
Tue Dec 05 03:17:07 +0000 2017,Tickets on sale Dec 11 at 12pm local 
Tue Dec 05 03:14:24 +0000 2017,
Mon Dec 04 20:25:01 +0000 2017,Theres no place like homewhy my  beats hardest for LA every time  More on Xfinity 
Sun Dec 03 19:41:12 +0000 2017,
Sun Dec 03 05:20:31 +0000 2017,Picture this you in a bebe shirt smelling of lovespell listening to Pardon me by Incubus on your disc man running carefully so it doesnt skip home to AIM your long distance bf on your grape iMac while your bagel bites heat in the microwave
Fri Dec 01 19:43:58 +0000 2017,The LAST night of the    tour is on sale now  me and  in Vancouver on Feb 6 and well make it a FAB FINALE   
Fri Dec 01 14:05:43 +0000 2017,Peru I cant wait to see you  Tickets to Witness The Tour in Lima are available now  
Thu Nov 30 19:29:07 +0000 2017,Check out my little fawn  and her very first video as a psycho stalker fan for 
Thu Nov 30 19:14:01 +0000 2017,Thanks for the love   
Thu Nov 30 18:47:54 +0000 2017,Shes obsessed and Im obsessed with her  Check out this little fawn and her first video for Only With You 
Wed Nov 29 21:25:08 +0000 2017,TIS THE SEASON Scroll right to see some of my favorite holiday styles from  
Wed Nov 29 15:11:06 +0000 2017,Its your turn Buenos Aires  Witness The Tour tickets available now at  
Wed Nov 29 14:07:13 +0000 2017,Santiago Your Witness The Tour tickets are on sale now   
Wed Nov 29 08:24:13 +0000 2017,nbd asking Warren Buffet his thoughts on cryptocurrency  Berkshire Hathaway 
Tue Nov 28 02:16:34 +0000 2017,"ASIA I am bringing WITNESSTHETOUR to you in 2018  
Be sure to stay on the LKOUT for more cities soonDetails at  "
Mon Nov 27 16:56:10 +0000 2017,Toronto I really saw myself in you  Halloween on WITNESSTHETOUR was WILD  See the full video on xfinity 
Mon Nov 27 00:40:41 +0000 2017,No one will ever believe in you if YOU dont believe in you
Fri Nov 24 19:12:33 +0000 2017,SOUTH AMERICA your one true girl is coming through like you knew she would  Cant wait for you to WITNESSTHETOUR details at  MORTA LINDA 
Thu Nov 23 08:12:43 +0000 2017,
Wed Nov 22 16:03:29 +0000 2017,The FINAL night of the    tour has just been added in Vancouver on Feb 6 Were going to leave it all on the stage right  Tickets on sale 121 at 10AM PT  
Mon Nov 20 20:34:01 +0000 2017,SCROLL RIGHT Honored to be a muse for the magical artist ursfischers BLISS Visit my 
Mon Nov 20 09:22:02 +0000 2017,HOLY SHIT   PERFORMANCE IS THE STUFF OF LEGEND
Mon Nov 20 03:02:12 +0000 2017, premieres in MARCH but voting starts tonight Were giving  lucky singer a second shot at a golden ticket to HOLLYWOOD Vote now you have the power to make their dreams come true   
Sat Nov 18 16:14:05 +0000 2017,Hola Mexico were coming for that spiceAll your WITNESS The Tour tickets are on sale now  
Fri Nov 17 08:10:08 +0000 2017,Cant skip the steps gotta pay your dues Warped Tour 2008 fbf 
Wed Nov 15 16:07:06 +0000 2017,Mexico City your Santander  presale starts now  
Wed Nov 15 01:53:46 +0000 2017,Most confusing driving question ever Its a left right
Wed Nov 15 00:23:59 +0000 2017,resonate 
Tue Nov 14 15:28:47 +0000 2017,Mexico CityWere going back to back   A second chance to WITNESSTHETOUR has been added for Friday May 4 and the Santander presale starts tomorrow at 10am CT    
Tue Nov 14 01:07:35 +0000 2017,Turning  on WITNESSTHETOUR I got woken up w confetti  attacked with silly string during yoga and all my fav people popped out from under the stage See the full bday shenanigans on Xfinity 
Thu Nov 09 08:23:43 +0000 2017,2017 is the year of gender reveals
Mon Nov 06 23:23:54 +0000 2017,roll please Counting down to the show and to 3 nights of Staples Center this week WITNESSTHETOUR and more on Xfinity  
Mon Nov 06 14:45:49 +0000 2017,your calendars  lets find an IDOL will premiere Sunday March 11 on ABC AmericanIdol 
Mon Nov 06 09:17:02 +0000 2017,prayer without action is powerless
Sat Nov 04 06:44:41 +0000 2017,Sometimes I think I wanna change the world and I forget it just starts with changing me 
Fri Nov 03 01:53:36 +0000 2017,Just saw Ingrid Goes Westone of my fav films this yearamp frighteningly true about our mental state concerning our social media lives
Tue Oct 31 18:50:33 +0000 2017, going to yoga ttyl
Tue Oct 31 18:48:40 +0000 2017,mind blown 
Tue Oct 31 18:44:23 +0000 2017, I share most on Instagram Stories these days twitter is legit too troll heavy
Tue Oct 31 18:38:35 +0000 2017, Katy Perry
Tue Oct 31 18:18:58 +0000 2017,never forget  
Tue Oct 31 18:17:38 +0000 2017,
Tue Oct 31 18:13:53 +0000 2017,only katycats will know about the angel eggs 
Mon Oct 30 17:52:46 +0000 2017,Every tour has a show number   amp the adrenaline was PUMPINGMontreal you were WITNESSTHETOURs  See the whole video amp more on Xfinity 
Mon Oct 30 17:01:56 +0000 2017,TRNTBRING UR KATY HALLOWEEN COSTUME   GAME TO THE SHOW ON TUESDAY HALLOWEEN NIGHT amp 
Fri Oct 27 23:16:39 +0000 2017,Monterrey  Thanks to U the first show is SOLD OUTADDING 59 so I can  you ALLSantander  presale 111 10am  
Wed Oct 25 23:17:43 +0000 2017,help Ive just eaten a slice of chicagos deep dish pizza and I cant get up
Wed Oct 25 14:03:03 +0000 2017,"HOLA MEXICO te veo pronto u  on WITNESSTHETOUR
Mexico CityMonterrey on sale Sun
Guadalajara on sale 111
 "
Wed Oct 25 07:05:56 +0000 2017,happy new year for me gonna make this one an even more powerful and transformative one 33 JupiterInScorpio
Mon Oct 23 19:49:10 +0000 2017,It takes a village to build a tour WITNESSTHETOUR from a different  For more say Witness Katy Perry into your X1 Xfinity remote 
Thu Oct 19 04:09:23 +0000 2017,SMASHVILLE aka Nashville u were an INCREDIBLE time tonight Thanks for teaching me how 2write a real song amp sticking by me all these years
Tue Oct 17 19:13:50 +0000 2017,I see your custom license plate and raise you this  
Mon Oct 16 20:08:10 +0000 2017,From a small dance studio  to the big stage Take a peek behind the  at how WITNESSTHETOUR came together xfinity 
Mon Oct 16 03:17:25 +0000 2017,
Sun Oct 15 18:59:47 +0000 2017,"Kween Kong Strong 

  New Orleans Louisiana "
Fri Oct 13 19:16:29 +0000 2017,Its Friday the 13th What better day to plan your Halloween LEWK with these glow in the dark loafs     
Fri Oct 13 17:17:48 +0000 2017,come with it kids  
Wed Oct 11 22:00:28 +0000 2017,
Wed Oct 11 21:52:49 +0000 2017,youre like a hard candy with a surprise center  
Tue Oct 10 16:03:32 +0000 2017,IAmWhatIMakeUpand my new  fam and I  cant wait to show you that EVERYONE can look in any styleat any age 
Mon Oct 09 03:43:37 +0000 2017,Golden Girl by zaldynyc witnessthetour  
Sat Oct 07 18:12:48 +0000 2017,CYRUS SANDWICH   Madson Square Garden 
Fri Oct 06 05:39:42 +0000 2017,deliciousness 
Thu Oct 05 18:08:40 +0000 2017,TBT to when I live streamed my life for 4 wonderfully weird days  the highlightslowlights on  now  
Mon Oct 02 22:21:08 +0000 2017,"Repost cleowade

As I prayforlasvegas I pray for us all Find each other out there "
Mon Oct 02 20:58:47 +0000 2017,Fucking devastated furious and heartbroken I mourn today
Sun Oct 01 22:21:31 +0000 2017,Now u can spin me right round baby right round  WITNESS is on VINYL amp  has the exclusive cover  
Sat Sep 30 04:55:46 +0000 2017,A group of flamingos is called a FLAMBOYANCE which is what I am naming my side project ok  TD 
Fri Sep 29 22:02:01 +0000 2017,Omg dreams do come true Thanks   friends  
Fri Sep 29 21:46:48 +0000 2017, 
Fri Sep 29 21:42:02 +0000 2017,Only With You is the song that made me become an official Cynner Check out this heavenly babygurl  
Fri Sep 29 20:01:35 +0000 2017,SO excited I feel like DANCING ON THE CEILING Time to KICK THE DUST UP  lets do this  thing  
Wed Sep 27 17:33:38 +0000 2017,If u missed the wild wonderful WITNESS  human social experiment weve got the highlights coming to u soon 
Wed Sep 27 01:01:44 +0000 2017,HEY THANKS SO Katycats 
Mon Sep 25 14:47:01 +0000 2017,Our brothers amp sisters in PurertoRico can use our help right now Lets show our love and support however we can 
Thu Sep 21 04:32:17 +0000 2017,Firework Finale by zaldynyc by  witnessthetour  Montreal Bell Centre 
Thu Sep 21 04:22:50 +0000 2017,MASSIVE thanks to all the incredibly talented people who have helped me put together 
Thu Sep 21 04:14:38 +0000 2017, by  witnessthetour  Montreal Bell Centre 
Thu Sep 21 04:09:57 +0000 2017,SuPeR sTrIpEdby adamselman x   by  witnessthetour  Montreal Bell 
Thu Sep 21 03:47:32 +0000 2017,silver surfer by adamselman x  boots by  by  
Thu Sep 21 03:37:35 +0000 2017,Polkadot Perry by adamselman x  boots by   by  
Thu Sep 21 03:22:23 +0000 2017,album art jacket by  by  witnessthetour  Montreal Bell Centre 
Thu Sep 21 03:16:31 +0000 2017,hello weirdo  Montreal Bell Centre 
Thu Sep 21 03:10:55 +0000 2017,"80s 
power suit collab by adamselman x   
 by   "
Thu Sep 21 03:03:16 +0000 2017,this is how you roll the dice witnessthetour   Montreal Bell Centre 
Thu Sep 21 02:57:01 +0000 2017,ruby sparkler by adamselman x   by   Montreal Bell Centre 
Thu Sep 21 02:50:10 +0000 2017,OPENING witnessthetour  Montreal Bell Centre 
Wed Sep 20 05:15:40 +0000 2017,Montreal you were beyond beautiful an incredible reminder of how important it is to dance amp sing together right now I am so grateful 
Tue Sep 19 22:49:55 +0000 2017,its almost time tiny dancer witnessthetour 
Mon Sep 18 23:51:07 +0000 2017,ITS TOMORROW CANT WAIT TO FINALLY U WITNESSTHETOUR 
Mon Sep 18 03:30:39 +0000 2017,days till WITNESSTHETOUR and we played hooky  
Sun Sep 17 23:56:42 +0000 2017,Wanna have a heart of appreciation and an undefeated mind 
Sat Sep 16 19:52:50 +0000 2017,days till WITNESSTHETOUR  
Sat Sep 16 00:13:20 +0000 2017,days till WITNESSTHETOUR  
Fri Sep 15 20:14:10 +0000 2017,Remember youre not failing youre learning
Fri Sep 15 01:58:22 +0000 2017,days till WITNESSTHETOUR  
Thu Sep 14 00:39:57 +0000 2017,days till WITNESSTHETOUR  
Thu Sep 14 00:25:29 +0000 2017,CUTE AS A BUTTON 
Tue Sep 12 23:06:33 +0000 2017,days till WITNESSTHETOUR  
Tue Sep 12 03:37:50 +0000 2017,my personal hero 
Mon Sep 11 18:39:53 +0000 2017,days till WITNESSTHETOUR Weve just made room in the DROP ZONEMORE pit tickets now available  
Mon Sep 11 01:55:50 +0000 2017,days till WITNESSTHETOUR  
Sun Sep 10 04:31:52 +0000 2017,Sending strength amp love to so many people all over the world who are going through disastrous times right now I pray rainbows come soon
Sat Sep 09 21:12:08 +0000 2017,days till WITNESSTHETOUR  
Sat Sep 09 06:54:46 +0000 2017,13 year old me Wannabe popstar  
Fri Sep 08 20:37:23 +0000 2017,Check out this cozycute lyric video for TOGETHER from my lullaby Lolita   
Thu Sep 07 14:55:21 +0000 2017,WERE LESS THAN  WEEKS AWAYWhat  do you want to hear at WITNESSTHETOUR 
Tue Sep 05 20:29:30 +0000 2017,LAST DAY TO ENTER 
Thu Aug 31 22:03:38 +0000 2017,NEW ZEALAND Tickets amp VIP packages for both WITNESSTHETOUR Auckland  shows are on sale now    
Wed Aug 30 04:05:28 +0000 2017,"NEW ZEALAND DUE TO DEMAND a 2nd WITNESSTHETOUR show has been added in Auckland
Tickets on sale Fri Sept 1  "
Tue Aug 29 22:15:16 +0000 2017,WITNESS THE TOUR IS 3 WEEKS AWAY Cant wait to play ur favs amp some newbies  who ull bring OR the one u wanna amp the night away with 
Mon Aug 28 10:11:53 +0000 2017,"LKS from the vmas 2017

      "
Mon Aug 28 04:29:14 +0000 2017,Well now I can sleep because  recognized my existence VMAS 
Sun Aug 27 23:42:54 +0000 2017,"Tune into the  tonight I cant be Khaleesi but I can be your good ole Katy I promise it will figuratively slay
 katyiscoming"
Sun Aug 27 20:04:49 +0000 2017,TWICE AS NICE 
Sun Aug 27 04:42:59 +0000 2017,YOUR HOSTESS WITH THE MOSTESTvmas  
Sat Aug 26 22:00:31 +0000 2017,NEW ZEALAND 1st chance for WITNESSTHETOUR  is for Visa holdersVisa Entertainment presale  10am Monday 
Fri Aug 25 18:12:21 +0000 2017,Major situation 
Fri Aug 25 18:08:11 +0000 2017,wait thats just my face  
Fri Aug 25 18:03:56 +0000 2017,You always Swish Thais  
Fri Aug 25 18:02:43 +0000 2017,hey look thats cool thanks friends  
Thu Aug 24 23:57:07 +0000 2017, same
Thu Aug 24 23:56:00 +0000 2017, Grandmas still got it
Thu Aug 24 23:54:03 +0000 2017,Life just smacks me in the face sometimes  
Thu Aug 24 23:52:06 +0000 2017, When will your fav ever
Thu Aug 24 23:51:20 +0000 2017, Shes raising two bb girls had to pass the headgear on
Thu Aug 24 23:50:14 +0000 2017,If you cant make fun of yourself its no fun  love you too  
Thu Aug 24 20:46:54 +0000 2017,
Thu Aug 24 07:22:03 +0000 2017,TUNE IN TO THE MOST ABSURD GAME OF THE CENTURY  vs  STARTS NOWSWISHSWISH  
Thu Aug 24 02:04:49 +0000 2017,SITTING ON A PYRAMID OF YOUR PATIENCE FOR THE DEBUT OF SWISHSWISH MOMENTSAWAY     
Wed Aug 23 18:03:25 +0000 2017,NZ ITS YOUR TURN WITNESSTHETOUR is coming to Aucklands Spark Arena on 20 Aug 2018Tickets on sale 1 Sept 
Tue Aug 22 05:49:16 +0000 2017,the story behind INDI 
Mon Aug 21 21:24:58 +0000 2017,ICYMI   amp  are joining me on WITNESSTHETOUR  Well  you there 
Mon Aug 21 07:13:07 +0000 2017,COUNTDOWN TO CATASTROPHE swishswish thisweek   
Mon Aug 21 04:02:28 +0000 2017,sleeping through the eclipse tomorrow just to be different ok 
Thu Aug 17 21:10:34 +0000 2017,WITNESS  January 5February 5  
Thu Aug 17 17:02:33 +0000 2017,WITNESS  November 7December 20 
Thu Aug 17 16:05:56 +0000 2017,WITNESS  September 19November 1 
Thu Aug 17 12:04:58 +0000 2017,SOME  NEWS AND SOME  NEWS but I promise were gonna be  
Thu Aug 17 02:13:24 +0000 2017,Orlando amp Portland One more sleep til the Idol tour bus  pulls up to your city Audition info at  TheNextIdol  
Tue Aug 15 16:37:22 +0000 2017,INDIis here For you me everyone because were all different together Share WhatMakesYouINDI    
Fri Aug 11 22:00:39 +0000 2017,FEELS GOODpun intended 
Fri Aug 11 19:43:31 +0000 2017,"These boots are beaut

Repost 

Grams got game Were spending a week at "
Thu Aug 10 18:54:59 +0000 2017," SEPTEMBER ISSUE
  
 
 yadim
 ShayaShual "
Wed Aug 09 00:06:03 +0000 2017,AUSTRALIA Tickets amp VIP packages for new WITNESSTHETOUR shows in Perth Melbourne and Sydney are on sale now  
Mon Aug 07 18:18:49 +0000 2017,Cant wait to share the stage with all these amazing artists on 827  VMA 
Fri Aug 04 19:35:56 +0000 2017,FBF Whos getting excited for the VMAs Big  announcements coming Monday  
Thu Aug 03 14:55:59 +0000 2017,Auditions kick off on Aug 17    Nuggets ready  are you More cities at  TheNextIdol 
Wed Aug 02 23:04:53 +0000 2017,AUSTRALIAYour 1st chance for  to the new WITNESSTHETOUR shows is through the Telstra presale today  3pm 
Wed Aug 02 19:14:43 +0000 2017, 
Tue Aug 01 22:52:51 +0000 2017,Some of my fav boots from the fall    
Tue Aug 01 08:25:58 +0000 2017,lololololololololol 
Mon Jul 31 21:02:39 +0000 2017,Australia BY POPULAR DEMAND more WITNESSTHETOUR shows in Perth Melbourne amp Sydney Tickets on sale 89  
Mon Jul 31 14:44:00 +0000 2017,donate school supplies OR apply to volunteer to earn GREAT tickets to see me on WITNESSTHETOUR  WitnessTheFuture 
Mon Jul 31 14:43:43 +0000 2017,Actions speak louder than Tweets We can create change in our own communities sign up w  amp visit your local  to 
